objectid,title,alternatetitle,category,externalurl,institution,access,sourcelist,tags,description,sau,lastmodified
1009,Hong Kong and Macau Index to Chinese Periodicals,香港中文期刊論文縮印,Subject Guides and Bibliographies,https://hkinchip.lib.cuhk.edu.hk/en/,Chinese University of Hong Kong,subscription,Princeton China Studies Research Guide,"Hong Kong,Macau,Secondary sources,Newspapers and periodicals","Hong Kong and Macau Index to Chinese Periodicals (HKInChiP) is a bibliographic index to Chinese and bilingual academic and cultural journals published in Hong Kong and Macau, with a focus on humanities and social sciences. Developed by the Chinese University of Hong Kong Library in 1999 (originally as the Index to Chinese Periodicals of Hong Kong), the database expanded to include Macau periodicals through collaboration with the University of Macau Library in 2005, and was relaunched on a new platform with the current name in 2025. Most journals are indexed from 1980 onwards; the earliest title in the database dates to 1853. In addition to bibliographic citation data, the database provides links to full-text images of certain articles.",7,5/18/2026 11:16pm
1010,Kao gu,考古,Academic Journals and Articles (Contemporary),https://www.kaogu.cn/,Chinese Academy of Social Sciences,subscription,Princeton China Studies Research Guide,"Archaeology,Secondary sources,Full-text","Kao gu (考古) is a peer-reviewed monthly journal of Chinese archaeology published by the Institute of Archaeology of the Chinese Academy of Social Sciences (CASS). Founded in 1955, it is one of the premier journals in the field, publishing excavation reports, research articles, and field surveys on archaeological discoveries across China. Many articles include English abstracts. Full-text access to back issues is available through CNKI for subscribing institutions.",7,5/14/2026 3:17pm
1011,National Palace Museum eJournals (Airiti),,Academic Journals and Articles (Contemporary),https://www.airitilibrary.com/,National Palace Museum (Taiwan),subscription,Princeton China Studies Research Guide,"Taiwan,Art and Architecture,Full-text,Secondary sources,Newspapers and periodicals","Provides access to the periodicals published by the National Palace Museum in Taibei, Taiwan: the 3 Chinese periodicals Gugong wenwu yuekan (National Palace Museum Monthly of Chinese Art), Gugong jikan (National Palace Museum Quarterly), and Gugong xueshu jikan (National Palace Museum Research Quarterly) as well as the National Palace Museum Bulletin (published in English). All three Chinese periodicals are full-text searchable.",7,5/18/2026 11:16pm
1012,Policy Commons,,Subject Guides and Bibliographies,https://policycommons.net/,Policy Commons,subscription,Princeton China Studies Research Guide,"Secondary sources,International relations,Contemporary (post-1978)","Policy Commons is a discovery platform for the research output of international organizations, think tanks, intergovernmental organizations (IGOs), and non-governmental organizations (NGOs) worldwide. The platform aggregates policy research, reports, and working papers on topics including economics, international relations, governance, and public policy. For China studies researchers, it is useful for locating policy documents and think-tank analyses from international bodies and NGOs concerning China and East Asia.",6,5/18/2026 11:16pm
1013,Quanguo baokan suoyin,全国报刊索引,Academic Journals and Articles (Late Qing and Republican),https://www.cnbksy.com/,Shanghai Library,subscription,Princeton China Studies Research Guide,"Late Imperial (1368–1912),Republican era (1912–1949),Contemporary (post-1978),Full-text,Newspapers and periodicals","The Quan guo bao kan suo yin 全国报刊索引 (National Index to Chinese Newspapers & Periodicals) compiled by Shanghai Library is a collection of databases giving access to a diverse array of sources. The platform has a strong focus on the period from the late Qing Dynasty to the Republic. It also indexes articles published in Chinese periodicals from 1833 to current. Some of the resources are categorized index-only (in Chinese, pian ming shu ju ku 篇名数据库), some have the full-images of the indexed articles; the content itself is not text searchable (confusingly, and wrongly, this database is called quan wen shu ju ku, 全文数据库 in Chinese) and other parts of the resources on the platform are actually full-text searchable (全文搜索版). Most of the journal and newspaper publications from the late Qing and Republican periods are full-images of the indexed articles; lately the platform also has added Republican e-books which are full-text searchable. Post 1949 the database includes indexes only, and in most cases it would be better to search the China Academic Journals database instead. The three kinds of databases are integrated on one and the same platform. Downloadable articles show a pdf icon. For most flexible search, click on the ""search center"" icon (进入检索中心). You can then specify which database(s) to search, etc. The full-image databases include the Late Qing and part of the Republican Periodical databases (Wan Qing qi kan quan wen shu ju ku 晚清期刊全文数据库, 1833–1911, and Minguo shi qi qi kan quan wen shu ju ku 民国时期期刊全文数据库, 1911–1949). The Late Qing database includes 625 journals. The Republican full-image database currently includes some 22,000 journals. For most of the Late Qing and the Republican journals full-text searching is not possible. The database also includes a large number of Chinese and English language newspapers that are mostly indexed on the article title level. A small selection of newspapers is full-text searchable. One important feature of the database is that it indexes images (mostly news photography) and advertisements.",9,5/18/2026 11:16pm
1014,Renda funü yanjiu,人大妇女研究,Academic Journals and Articles (Contemporary),http://www.wsic.ac.cn/,Women's Studies Institute of China (All-China Women's Federation),subscription,Princeton China Studies Research Guide,"Gender,Secondary sources","Renda funü yanjiu (人大复印报刊资料·妇女研究) was a retrospective compilation of selected journal articles on women's studies in China, published as part of the Renmin University Copies of Chinese Periodicals (人大复印报刊资料) series, covering gender, women's rights, and women's history topics published between 1995 and 2001. The linked resource, Women's Studies Institute of China (WSIC, wsic.ac.cn), is operated by the All-China Women's Federation and provides online access to the journal 妇女研究论丛 (Collection of Women's Studies Research) along with related indexing resources for current women's studies scholarship in China.",5,5/18/2026 11:16pm
1015,Sinica SinoWeb,經典人文學刊庫,Academic Journals and Articles (Contemporary),https://p.udpweb.com/,Academia Sinica,subscription,Princeton China Studies Research Guide,"Taiwan,Secondary sources,Newspapers and periodicals,Full-text","This database gives access to past and (if applicable) current issues of the following Sinological periodicals published in Taiwan (mostly from the Academia Sinica): 中央研究院歷史語言研究所集刊, 中央研究院中國文哲研究集刊, 中央研究院近代史研究所集刊, 中央研究院近代中國婦女史研究, 中央研究院口述歷史期刊, 中央研究院近代中國史研究通訊, 中央研究院臺灣人類學刊, 中央研究院臺灣史研究, 漢學研究, 思与言, 鵝湖學誌, 鵝湖月刊, 食貨月刊, 民俗曲藝. The home page is in English; you may want to change to Traditional Chinese for better results. This database was previously offered as a stand-alone resource and is now hosted as part of the Taiwan Academic Classics (台灣學術經典) platform.",8,5/14/2026 4:27pm
1016,Taiwan Electronic Periodicals Service,台彎電子期刊 (airiti library),Academic Journals and Articles (Contemporary),https://www.airitilibrary.com/,Airiti Inc.,subscription,Princeton China Studies Research Guide,"Taiwan,Medicine,Secondary sources,Newspapers and periodicals,Full-text","The TEPS (Taiwan Electronic Periodicals Service) database now included in the Airiti Digital Library offers an archive of several hundred Taiwanese periodicals in various subjects, including natural and applied sciences, medicine, the humanities, and social sciences. Full texts can be downloaded in PDF format. One can browse by title. The TEPS collection is part of the Chinese Electronic Periodical Service (CEPS) database. The majority of the journals included in the database are covered in electronic form from 2000 on-wards, but there are many journals with digital back issues going back to the mid-20th century. The database even includes some 1930s journals.",7,5/18/2026 11:16pm
1017,Wanfang xueshu huiyi,万方学术会议,Academic Journals and Articles (Contemporary),https://www.wanfangdata.com.cn/,"Wanfang Data Co., Ltd.",subscription,Princeton China Studies Research Guide,"Secondary sources,Full-text","Wanfang’s Academic conference papers database. Searches more than 2 million conference papers. Also browsable by topic and then year. Although an extra function “full text only” is available, differences between “all” and “full-text only” seem to be minimal. As with all Wanfang databases, once on the Wanfang home page, you can move from database to database via tabs. The “xue shu lun wen” tab combines several databases into one mega-search, and you can also combine searches across databases using the advanced search option.",7,5/18/2026 11:16pm
1018,Wanfang xueshu qikan,万方学术期刊,Academic Journals and Articles (Contemporary),https://www.wanfangdata.com.cn/,"Wanfang Data Co., Ltd.",subscription,Princeton China Studies Research Guide,"Full-text,Secondary sources,Newspapers and periodicals","Wanfang’s Online academic journals or Periodicals database . More than 22 million full-text searchable articles, which are also browsable by topic or journal. Covered years are fewer than the China Academic journals database (most journals do not go back further than 2001), and page numbers are only visible when viewing the article itself, not in the index. Hence, searching CNKI’s China Academic Journals should be your first choice for finding articles; yet, with exclusive online contracts on the rise in China, some journals may be only available in one database and not the other. Again, you can narrow down your results not only by using the topical and chronological facets, but also by typing within the tab-looking grey boxes on top of your results: e.g., by typing 2003 to 2008 in the starting and concluding year boxes. As with all Wanfang databases, once on the Wanfang home page, you can move from database to database via tabs. The “xue shu lun wen” tab combines several databases into one mega-search, and you can also combine searches across databases using the advanced search option.",8,5/14/2026 4:27pm
1019,Wenshi ziliao indexes,文史资料,Archival Material,http://www.wenshiziliao.com/,,subscription,Princeton China Studies Research Guide,"Historical archive,Republican era (1912–1949),Late Imperial (1368–1912),Local history,Contemporary (post-1978),Full-text,Early PRC (1949–1966)","Wenshi ziliao are collections on local history that are being published on all administrative levels in form of open-ended series. The collecting and editing of Wenshi ziliao was first suggested in April 1959 by Zhou Enlai to document the experience of modernization 60 years after the reform movement of 1898. Local 文史研究馆所 were set up and supported by the Political Consultative Conference. During the past 60+ years they have often changed from internal to open publications and back. Estimations of the amount of Wenshi ziliao issues are hovering between 80,000 to 100,000 volumes. Here table of contents indexes are available for searching on each administrative level (with some exceptions like Xinjiang), and the underlying PDFs can also be downloaded for local use. Altogether there are about 1,250 documents with about 45,800 pages of article information for about 500,000 articles. So far online access is only available to a small subset of Wenshi ziliao. Lately the 抗日战争与近代中日关系文献数据平台of the CASS 近代史研究所 made some 16,000 volumes of Wenshi ziliao freely accessible .",7,5/18/2026 11:16pm
1020,Bianjiang Lishi Dili Shujuku,邊疆歷史地理數據庫,Classical Texts,https://bianjiang.ancientbooks.cn/,Zhonghua Book Company,subscription,Princeton China Studies Research Guide,"Late Imperial (1368–1912),Republican era (1912–1949),Xinjiang,Tibet,Inner Asia,Manchuria","This database has two parts. The first part called 史地經典文庫 collects full-text historical textual material on the Chinese borderlands dating from the Ming Dynasty to the Republic in the punctuated editions by Zhonghua shuju. The second part 邊疆史料文庫 gives access to Republican monographs, periodicals, government gazettes and other documents on the history of the border regions. The original printed text is displayed side-by-side with a fully searchable digital edition of the text for comparison. Downloading is not possible. Copying (with a maximum of 200 characters at a time after signing in) is possible, but only using the pop-up copy function, not the usual browser function. To use the database you need to register a personal account. To sign in, choose 登录 on the upper left and then switch to 邮箱登录 on the following page. Please note: This database does not fully support the Firefox browser.",7,5/18/2026 11:16pm
1021,CADAL (China Academic Digital Associative Library),大学数字图书馆国际合作计划,E-books (Contemporary),https://cadal.edu.cn/,Zhejiang University,subscription,Princeton China Studies Research Guide,"Manchuria,Global China,Late Imperial (1368–1912),Republican era (1912–1949),Contemporary (post-1978),Literature,Art and Architecture,Medicine,Local history,Diaspora,Full-text","CADAL (China Academic Digital Associative Library) is a government-sponsored cooperative project of some 120+ academic libraries (2020), about half of which are from China, to create electronic resources for the use of their patrons. The venture is led by and housed in Zhejiang University, and most major Chinese academic institutions such as Peking, Qinghua, Fudan and Nanjing universities were participants from the beginning. CADAL originally grew out of a China-American Digital Academic Library venture, but only from the mid-2010s a select group of overseas libraries have received access. The major resource created by CADAL is a collection of scanned books, both in and out of copyright: 240 thousand ancient texts (including the Xuxiu siku quanshu 续修四库全书), 180 thousand republican works, 155 thousand republican periodical issues, 40 thousand newspaper issues, 800 thousand post-1949 books, 690 thousand works in Western languages, 13 thousand special collection works, 4 thousand videos, 55 thousand audiobooks and 63 thousand images. The collection is constantly increasing. The titles are not full-text searchable; but tables of contents are provided for easy navigation. Lately CADAL has added some special sections for material connected to the Manchuria Railway 满铁 13 thousand titles, modern local gazetteers 17 thousand, material on overseas Chinese 侨批 50 thousand items, and oracle bones from various institutions scanned with Reflectance Transformation Imaging (RTI) technology. (In addition to the e-books database, the navigation bar also gives access to some other resources: calligraphic works ( shufa 书法), a literary timeline ( Zhongguo wenxue biannian shi 中国文学编年史), Chinese medicine ( zhongyiyao 中医药), and Audio ( yinpinku 音频库). Note that the video choice, available only in English, brings one to the main e-books database.) Access to the books is dependent on the copyright status of the book: while some free access is available, especially to the ancient texts, access to in-copyright books is restricted to registered users at participant libraries: one borrows parts of books, which need to be returned in order to have them become available to other users. Hence, one first has to register ( zhuce 注册), and in subsequent visits to log-in ( denglu 登录). For this please select 登录/注册 from the upper right of the CADAL home page. To register then click on 快速注册. Please note that it is not necessary to add a mobile phone number 手机号 in order to register and it is also not necessary to retrieve a verification code if one does not want to connect the personal account to a Chinese mobile phone number. The registration process can be solely finished via a valid email. After registration, the system will ask for an affiliation at the first login. Activities one performs when logged-in, including borrowing books, note-taking etc., are visible to all users from search pages etc.: hence, make sure to log-out especially on shared public computers. One is not logged out automatically, even not after days. To log-out, go to one's personal account page ( registeredname's CADAL in the English, registeredname 的 CADAL in the Chinese interface), and click on tuichu 推出. This account page is available in the top navigation bar, and is also the page from where one returns books, see one's borrowing history, etc. (One can choose to set the interface to English, but only a limited number of top-level screens have been translated.) Once logged in, and directed to one's account page, one can perform a simple search in the search box. On the resulting page, one can somewhat refine one's search by limiting the result to title or author, and by selecting some rough facets of categories (such as ancient books or republican-period books—note that all categories are listed, even if not applicable), tags ( biaoqian 标签 ) or publisher. Under a cover image of each result, one can choose to see more details on the book, or decide to read it by clicking on the book. If choosing to read it, one is brought to a reader interface where one can display the table of contents, navigate forward and backward within a book, and change the display from one page to two pages at a time and vice versa. Printing (by right-clicking, one page at a time) does not work very well—it may be better to take screen shots. Depending on the copyright status of the book, one will receive a request after viewing a couple of pages to check out the remainder of the chapter ( jieyue 借阅). One receives a message that borrowing was successful (if the item was not borrowed by someone else), and can continue to read. To return the chapter to the CADAL library, navigate to the borrowing page ( jieyue in the top navigation bar), where one can see the status of one's checking in-and-out. Click, if not yet selected, on the weihuan 未还 button, and then return chapters by clicking on guihuan 归还 after each chapter one has checked out. And remember to log-out (also possible from this page.) One can look at one's notes, tags, comments, messages etc. from the navigation bar, and there may be recommendations listed based upon one's readings.",9,5/18/2026 11:27pm
1022,Chinese Periodicals of Modern Chinese Film,中国近代期刊电影专题数据库,Academic Journals and Articles (Late Qing and Republican),https://www.cnbksy.com/,Shanghai Library,subscription,Princeton China Studies Research Guide,"Republican era (1912–1949),Full-text,Newspapers and periodicals,Popular media","This database is a subsection of the Shanghai Library National Index to Chinese Newspapers & Periodicals. Other than most other parts of the National Index this subsection on film is full-text searchable. It gives access to 30 periodicals from the Republican period including titles such as 电声, 电影新闻, 电影, 电影杂志, 好莱坞, 电影话剧. Most of the content was published between 1930 and 1949.",6,5/18/2026 11:27pm
1023,Dacheng,大成老旧期刊,Academic Journals and Articles (Late Qing and Republican),https://www.dachengdata.com/,Dacheng Data,subscription,Princeton China Studies Research Guide,"Late Imperial (1368–1912),Republican era (1912–1949),Newspapers and periodicals,Full-text","A text-searchable database of ca. 7,000 Chinese periodicals published from late Qing to 1949 in all fields of knowledge: the humanities, social sciences, exact sciences, as well as popular journals. Examples include the Shidianzhai huabao, Xiandai, Shaonian Zhongguo, Dazhong shenghuo, Guocui xuebao, Qingnian Zhongguo, Minfeng. Listings per subject area are provided. Contents are regularly updated. One can search by keyword in title in simplified or traditional Chinese, which retrieves article titles; clicking on such a hit retrieves the page with the term, which however is not highlighted. One can browse by category of publication (use the pop-up menu called +fenlei tixi). Clicking on a periodical title gives the issues available of that title; clicking on the issue gives a table of content. PDFs can be downloaded. Advanced searching (by article or periodical title) is available. This database complements the Quanguo baokan suoyin database.",7,5/18/2026 11:27pm
1024,Early Chinese Periodicals Online (ECPO) (free),,Academic Journals and Articles (Late Qing and Republican),https://ecpo.cats.uni-heidelberg.de/ecpo/,University of Heidelberg,open access,Princeton China Studies Research Guide,"Late Imperial (1368–1912),Republican era (1912–1949),Gender,Newspapers and periodicals,Popular media,Full-text","Hosted at the University of Heidelberg, ECPO collects newspapers and other periodicals from the late Qing and Republican era. So far the emphasis has been on Chinese Women's Magazines in the Late Qing and Early Republican Period and Chinese Entertainment Newspapers ( Xiaobao 小報).",5,5/19/2026 3:52pm
1025,Minguo wenxian daquan,民国文献大全,E-books (Republican),https://cadal.hytung.com.cn/,Hantang Technology,subscription,Princeton China Studies Research Guide,"Republican era (1912–1949),Late Imperial (1368–1912),Full-text,Newspapers and periodicals","This database is based on the Republican era collection of CADAL (China Academic Digital Associative Library). For this database the books, journals and newspapers from CADAL have been processed with OCR (optical character recognition) which allows full-text searching. Most of the search results from books and journals can be directly opened from 民国文献大全.",7,5/18/2026 11:27pm
1026,Archives Unbound,,Archival Material,https://www.gale.com/primary-sources/archives-unbound,Gale,subscription,Princeton China Studies Research Guide,"Economy,Biography,Religion,Missionaries,Military,Colonialism,Late Imperial (1368–1912),Republican era (1912–1949),Full-text","Also known as the Declassified Documents Reference Service. These digital collections of historical material on many topics include manuscripts, printed books and periodicals, and government documents. The material comes from the U.S. National Archives, the U.K. National Archives, and many other libraries and archives. East Asian topics include: China (religion, Chinese Maritime Customs, Shanghai, international politics, economics, biographic material), Japan (religion, international politics, Japanese American internment, economics), and Korea.",8,5/18/2026 11:27pm
1027,"British Colonial Policy and Intelligence Files on Asia, 1880–1950",,Archival Material,https://brill.com/display/serial/BCPI,Brill,subscription,Princeton China Studies Research Guide,"Colonialism,Military,Late Imperial (1368–1912),Republican era (1912–1949)","This series comprises fourteen collections of historical British government documents pertaining to various countries in Asia and the Middle East on which intelligence was gathered. The original documents are part of the Oriental & India Office Collections (OIOC, now part of the Asia, Pacific, and Africa Collections), British Library, London.",7,5/18/2026 11:27pm
1028,"China, America and the Pacific",,Archival Material,https://www.cap.amdigital.co.uk/,Adam Matthew Digital,subscription,Princeton China Studies Research Guide,"Economy,Biography,Global China,Late Imperial (1368–1912),Missionaries,Full-text,Republican era (1912–1949)","An extensive range of archival material connected to the trading and cultural relationships that emerged between China, America and the Pacific region between the 18th and early 20th centuries. Manuscript sources, rare printed texts, visual images, objects and maps document this fascinating history. The resource includes a wide range of manuscript, printed and visual primary-source materials as well as other key features to support research and teaching. One can use the fully searchable interactive chronology to discover facts and world events, explore voyages to China using an interactive map, find out about different merchants and the companies they formed in the Merchant Biographies and view online exhibitions to find out about aspects of the collection. A helpful tour of the collection is available.",7,5/18/2026 11:27pm
