objectid,title,alternatetitle,category,externalurl,institution,access,sourcelist,tags,description,sau,lastmodified
1,CrossAsia Fulltext Search,,Subject Guides and Bibliographies,https://crossasia.org/service/crossasia-lab/crossasia-fulltext-search,Staatsbibliothek zu Berlin,open access,ACLS Open Database Resource Guide,"Full-text,Digital humanities","The CrossAsia Fulltext Search is built from textual resources hosted in the CrossAsia Integrated Text Repository (ITR) and is open to all users. Its aim is to help users find texts and sources relevant to their research questions by performing comprehensive fulltext searches across databases. Currently searchable: approximately 538,309 titles (books and issues) with 86.4 million pages archived in the CrossAsia ITR. The search interface offers two modes: a 'guided' search (Type A), in which hits are grouped and displayed by book and ranked by number of pages with hits; and an 'explorative' search (Type B), in which both fulltext and metadata are searched simultaneously and results are ranked by index score. In addition to fulltext search, CrossAsia also provides the CrossAsia N-gram Service, which publishes character frequency datasets for selected collections, and the CrossAsia ITR Explorer and CrossAsia ITR Newspaper Explorer, which enable analysis and visualization of data stored in the ITR. The ITR continues to grow with more fulltexts being added continuously.",9,5/13/2026 12:09am
2,Chinese big sets in IVY-Plus Libraries,,Subject Guides and Bibliographies,https://docs.google.com/spreadsheets/d/1I5DwJkpuZAnHrHC-8Be4NOuDuh5mA6dx2oG-OZ60pzg/edit?usp=sharing,Ivy Plus Libraries,open access,ACLS Open Database Resource Guide,Secondary sources,"In recent years publishers in mainland China have printed large collections of primary and secondary print material. This spreadsheet, maintained by Joshua Seufert of Princeton Libraries, provides information on bibliographic and Ivy Plus holding information for large sets of primary source materials published in mainland China. The list is current through July 2024 and contains 2947 titles currently held by Ivy Plus Libraries. The OCLC library codes are :RBN Brown, CGU Chicago, ZCU Columbia, COO Cornell, DRB Dartmouth, NDD Duke, HUL Harvard (Main Library and Yenching), HFL Harvard Fine Arts, HVL Harvard Law, JHE Johns Hopkins, PUL Princeton, PAU Upenn, STF Stanford, YUS Yale, and CRL Center for Research Libraries.",7,5/16/2026 1:14pm
3,ReCAP Chinese Journals public list,,Subject Guides and Bibliographies,https://docs.google.com/spreadsheets/d/165PydKvnv1nmWKMpi8bYFsKnY-ZMhkKNJ5gku7WdNCA/edit?gid=965348405#gid=965348405,ReCAP (Research Collections and Preservation Consortium),open access,ACLS Open Database Resource Guide,"Contemporary (post-1978),Newspapers and periodicals","This spreadsheet provides holding information on 1,350 Chinese periodicals archived by member libraries of the ReCAP (Research Collections and Preservation Consortium). ReCAP is a 501(c)3 not-for-profit corporation incorporated in 2000 that preserves collections and enables resource sharing among its member libraries: Columbia University, Harvard University, The New York Public Library, Princeton University, and Yale University. The spreadsheet lists journal titles, ISSN numbers, coverage dates, and holding information by institution, and is intended to help researchers identify which ReCAP member library holds a given Chinese periodical.",7,5/16/2026 1:14pm
4,East Asian Gateway Service,,Subject Guides and Bibliographies,https://library.pitt.edu/eal-gateway-service,University of Pittsburgh,open access,ACLS Open Database Resource Guide,"Macau,Hong Kong,Taiwan","The East Asian Gateway Service (EAGS) was established in October 1998 and has been financially supported by the University of Pittsburgh Library System since October 2001. The EAGS is a pioneer in developing transcontinental interlibrary partnerships, focusing on free delivery of full-text Chinese and Korean language academic publications to researchers. Chinese documents are available to any individual researcher or non-profit organization for research and teaching purposes who cannot find the needed item in any U.S. library. Korean language materials are available to University of Pittsburgh faculty and students only. The service is reciprocal, as ULS provides document delivery service of English language materials to Chinese and Korean partner libraries. The EAGS has succeeded in providing research support to thousands of China scholars in the United States and researchers in China. The EAGS has partnerships with libraries in mainland China, Hong Kong, Macau, Taiwan, and Korea, covering 40 states in America and serving more than 130 colleges and universities.",7,5/16/2026 1:14pm
5,National Center for Philosophy & Social Science Documentation,国家哲学社会科学文献中心(中国社科院),Academic Journals and Articles (Contemporary),https://www.ncpssd.cn/journal/index,Chinese Academy of Social Sciences,open access,ACLS Open Database Resource Guide,"Philosophy,Secondary sources,Full-text","Administered by the Chinese Academy of Social Sciences, the National Center for Philosophy and Social Science Documentation (NCPSSD) is a free open-access platform providing approximately 2,487 Chinese academic journals and collected works (期刊、集刊、辑刊), with over 27 million data entries covering philosophy, social sciences, and humanities. Journals are browsable by subject category (philosophy & religion, social sciences, politics & law, economics & management, cultural science, linguistics, literature, art, and history & geography), by national social science funding status, by core journal designation, by party-building designation, and by region. It includes approximately 20,000 Chinese rare books in high-resolution scans (with watermarks). Institutions can request IP-based access. The database interface is in Chinese only.",8,5/16/2026 1:14pm
6,Hong Kong Journals Online,,Academic Journals and Articles (Contemporary),https://digitalrepository.lib.hku.hk/hkjo,University of Hong Kong,open access,ACLS Open Database Resource Guide,"Hong Kong,Medicine,Secondary sources,Full-text","Hong Kong Journals Online (HKJO) is a full-text image database developed by the University of Hong Kong Libraries, providing access to selected academic and professional journals in both English and Chinese published in Hong Kong. Subjects covered include philosophy & religion, social sciences, law, language & literature, science & technology, medical & health, buildings & construction, arts & recreation, and history & geography. Issues included vary from journal to journal, with the earliest going back to 1872. Currently, more than 491,290 images from over 60 titles are accessible in the database. New issues continue to be added as they are received, and more titles with granted digitization permissions are being included. Scholars doing research on Hong Kong will find this an invaluable resource.",8,5/16/2026 1:14pm
7,NCL Taiwan Periodical Literature,臺灣期刊文獻資訊網,Academic Journals and Articles (Contemporary),https://tpl.ncl.edu.tw/NclService/,National Central Library (Taiwan),open access,ACLS Open Database Resource Guide,"Taiwan,Macau,Singapore,Hong Kong,Contemporary (post-1978),Literature,Full-text,Newspapers and periodicals","The NCL Taiwan Periodical Literature (formerly PerioPath: Index to Taiwan Periodical Literature System / 臺灣期刊文獻資訊網), developed by Taiwan's National Central Library, was originally launched as the Index to Chinese Periodicals in January 1970. The database indexes Chinese and Western language periodicals primarily published in Taiwan since 1970, with some journals from Hong Kong, Macau, and Singapore also included. The database currently covers more than 5,500 journal titles with more than 2.76 million article citations, of which approximately 420,000 articles have been authorized by publishers for open-access full-text viewing. Some academic journals published before 1970 are also available. The system provides comprehensive indexing for post-WWII periodical literature from Taiwan.",8,5/16/2026 1:14pm
8,PubScholar (Chinese),,Academic Journals and Articles (Contemporary),https://pubscholar.cn/,Chinese Academy of Sciences,open access,ACLS Open Database Resource Guide,"Science and Technology,Dataset,Secondary sources,Full-text","PubScholar is a free public welfare academic platform launched in November 2023 by the Chinese Academy of Sciences (CAS). The platform provides access to over 107 million journal articles, as well as preprints, patents, dissertations, scientific datasets, and open-source software—totaling several hundred million academic resources. Content is primarily focused on the natural sciences, engineering, and technology, though social sciences are also represented. PubScholar offers AI-powered tools including 'Kexun Toutiao' (科讯头条), an automated subject intelligence monitoring platform, along with intelligent literature summarization and document-level OCR. The platform interface is available in both Chinese and English. It supports the Directory of Open Access Journals (DOAJ) and is committed to open-access cooperation with academic resource institutions at home and abroad.",8,5/16/2026 1:14pm
9,Biblioteca Virtual de Macau,澳門虛擬圖書館,Academic Journals and Articles (Contemporary),https://www.macaudata.mo/,Macao Foundation,open access,ACLS Open Database Resource Guide,"Macau,Contemporary (post-1978),Full-text","The Biblioteca Virtual de Macau (澳門虛擬圖書館) is a free online reading platform established in 1999 by the Macao Foundation (澳門基金會), dedicated to Macau studies (澳門學). The platform provides open access to thousands of publications in or about Macao, including books, academic journals, and dissertations from local government agencies, universities, and cultural organizations. In addition to a searchable library of books and journals (書刊文庫), the platform features a Scholar Zone (學者專區) profiling researchers working on Macao, an Institutional Directory (機構團體) connecting publishers and academic bodies, an Academic News section (學術動態), and themed online exhibitions (專題特展). A major redesign in 2022 expanded full-text search capabilities and integrated scholarly news and book reviews. The platform accepts submissions of Macao publications from organizations and individuals and has a companion mobile app. Content is available in Chinese and Portuguese.",8,5/16/2026 1:14pm
10,Classical Historiography for Chinese History,中國經典文獻工具書錄,Subject Guides and Bibliographies,https://libguides.princeton.edu/chinese-historiography/,Princeton University,open access,ACLS Open Database Resource Guide,"Late Imperial (1368–1912),Philosophy,Secondary sources","Classical Historiography for Chinese History (中國經典文獻工具書錄) is a research guide compiled by Benjamin A. Elman, Professor of East Asian Studies and History at Princeton University, with contributions from collaborators at Fudan University, Academia Sinica, the University of Houston, and Princeton University. Originally developed from bibliography courses at the University of Pennsylvania (1975–1977), the guide provides annotated references to classical Chinese historiographical sources and sinological reference works. All entries are alphabetized within each section and romanized in Pinyin following Library of Congress guidelines. The entire site is searchable. The guide is hosted in Princeton University Library's LibGuides East Asian Studies Portal and was last revised in October 2022.",7,5/16/2026 1:14pm
11,Hong Kong Literature Database,香港文學資料庫,Archival Material,https://hklit.lib.cuhk.edu.hk,Chinese University of Hong Kong,open access,ACLS Open Database Resource Guide,"Hong Kong,Literature,Full-text,Newspapers and periodicals","The Hong Kong Literature Database (香港文學資料庫), developed by the Chinese University of Hong Kong Library, is the first comprehensive database on Hong Kong literature. As of June 2024, the database contains nearly 670,000 records, including over 200 Hong Kong literary journals, literary supplements from 20 early Hong Kong newspapers, and approximately 18,000 monographs, with over 180,000 items available as full-text images. The database offers multiple search functions including full-text search and image viewing, accessible without geographic restrictions, and serves as a platform for literary news, organizational activities, and writer information.",9,5/16/2026 1:14pm
12,Chinese Christian Texts Database,,Subject Guides and Bibliographies,https://www.arts.kuleuven.be/chinese-studies/english/cct,KU Leuven,open access,ACLS Open Database Resource Guide,"Missionaries,Philosophy,Religion,Late Imperial (1368–1912),Colonialism,Secondary sources","The Chinese Christian Texts Database (CCT-database), initiated by the late Professor Erik Zürcher and developed by Ad Dudink and Nicolas Standaert at KU Leuven, is a referential research database of primary and secondary sources concerning cultural contacts between China and Europe from 1582 to c. 1840, covering religion, philosophy, science, and art. The database contains approximately 1,050 Chinese primary sources (printed books, manuscripts, pamphlets, and maps), approximately 4,000 European primary sources, and over 11,000 secondary sources linked to primary sources where applicable. It is multilingual with extensive search capabilities and detailed bibliographical information including content descriptions, call numbers in major library collections, and notes on author and text history; thematic categorization follows the Handbook of Christianity in China: Volume One (635–1800). Access is free.",8,5/13/2026 5:00pm
13,The Ming History English Translation Project,,Classical Texts,https://minghistoryinenglish.com/,Hong Kong Baptist University,open access,ACLS Open Database Resource Guide,"Late Imperial (1368–1912),Biography,Full-text,Translation","The Ming History English Translation Project is a collaborative, ongoing effort to translate portions of the 明史 Mingshi (Official History of the Ming Dynasty) and other Ming-era texts into English. The Mingshi, presented to the Qing throne in 1736 and published in 1739, contains valuable information on Ming government, society, and prominent individuals from the period 1368–1644. The site also provides translations from the Da Ming Huidian (大明會典) and other Ming sources, contributed by scholars and students primarily under Creative Commons licenses. Originally founded at UC San Diego, the project is currently maintained by Yiming Ha at Hong Kong Baptist University.",7,5/13/2026 5:00pm
14,Ming Qing Women's Writings,明清婦女著作,Classical Texts,https://mhdb.mh.sinica.edu.tw/mingqing/mqww/,Academia Sinica,open access,ACLS Open Database Resource Guide,"Late Imperial (1368–1912),Gender,Literature,Biography,Full-text","Ming Qing Women's Writings (明清婦女著作) is a digital archive and database dedicated to the digitization and documentation of writings by women in late imperial China (1368–1911), originally launched at McGill University in 2005 and now hosted and maintained by Academia Sinica (updated October 2025). Close to 5,000 collections of poetry and writings by individual women are recorded for the Ming and Qing periods, though less than a quarter have survived. Each writer entry links to the China Biographical Database hosted at Harvard University. Digital assets were provided by partner libraries including Harvard-Yenching Library, Peking University Library, Sun Yat-sen University Library, and the Chinese University of Hong Kong Library.",9,5/13/2026 5:00pm
15,Modern Chinese Literature and Culture (MCLC) Resource Center,,Subject Guides and Bibliographies,https://u.osu.edu/mclc/,The Ohio State University,open access,ACLS Open Database Resource Guide,"Contemporary (post-1978),Literature,Art and Architecture,Popular media,Secondary sources","The MCLC Resource Center is the online companion to the print journal Modern Chinese Literature and Culture, maintained by Kirk A. Denton at The Ohio State University. It houses extensive bibliographies of mostly English-language materials on modern and contemporary Chinese literature, film/media, visual arts, music, education, and culture, as well as online articles, book reviews, and a blog. The Resource Center also hosts a Video Lecture Series featuring leading experts on modern Chinese literature and culture. Back issues of the print journal (with a one-year lag) are available through JSTOR.",8,5/16/2026 1:14pm
16,PRC History Group Resource List,,Subject Guides and Bibliographies,https://networks.h-net.org/h-prc,PRC History Group,open access,ACLS Open Database Resource Guide,"Republican era (1912–1949),Early PRC (1949–1966),Cultural Revolution (1966–1976),Contemporary (post-1978),Secondary sources","The PRC History Group is a scholarly network focused on the history of the People's Republic of China, now operating as H-PRC on the H-Net platform (https://networks.h-net.org/h-prc). The network hosts scholarly discussions, announcements, and publishes the PRC History Review, which contains research articles, roundtable discussions, and reviews of recent scholarship. The site also links to freely available Chinese-language journals focusing on the Cultural Revolution and other PRC topics, including Remembrance (记忆), Yesterday (昨天), and Past Events (往事). The group welcomes scholars, students, and others with serious interest in PRC history.",7,5/16/2026 1:14pm
17,China Reform and Opening Up Database,中国改革开放数据库,Archival Material,http://www.reformdata.org/records/,China (Hainan) Institute for Reform and Development,open access,ACLS Open Database Resource Guide,"Oral history,Contemporary (post-1978),Economy,Historical archive,Full-text","The China Reform and Opening Up Database (中国改革开放数据库) is a comprehensive documentary record of China's reform era from 1978 to 2018, organized in chronological format with four major sections: annual highlights, a chronology of major events, oral history interviews with reform participants, and material evidence and artifacts. Sponsored by the China (Hainan) Institute for Reform and Development, the database contains extensive full-text speeches, images, and oral history recordings documenting the forty-year reform period. Basic browsing is free, though downloading articles and images requires creating a personal account.",7,5/16/2026 1:14pm
18,Ivy Plus Libraries' Digital Projects on East Asia,,Subject Guides and Bibliographies,https://guides.library.duke.edu/ivypluseastasia,Duke University,open access,ACLS Open Database Resource Guide,"Digital humanities,Secondary sources","Ivy Plus Libraries' Digital Projects on East Asia is a LibGuide hosted by Duke University Libraries that serves as a shared platform for Ivy Plus consortium member libraries to publicize their published and ongoing digital projects related to East Asia. Participating institutions include Brown, Cornell, Columbia, Dartmouth, Duke, Harvard, Johns Hopkins, Princeton, Stanford, University of Chicago, University of Pennsylvania, and Yale. The guide provides project listings and contact information for East Asian librarians at each institution, and is updated periodically (most recently April 2025).",7,5/13/2026 5:00pm
19,Late Qing and Republican-Era Chinese Newspapers,,Newspapers,https://gpa.eastview.com/crl/lqrcn/,East View Information Services,open access,ACLS Open Database Resource Guide,"Late Imperial (1368–1912),Republican era (1912–1949),Military,Full-text,Newspapers and periodicals,Historical archive","The Late Qing and Republican-Era Chinese Newspapers collection, published by East View Information Services and made openly accessible through the Center for Research Libraries (CRL) and its member institutions, contains 292 newspaper titles, 70,393 issues, and over 463,000 pages of full-text searchable content representing the press of more than twenty Chinese cities from 1911 to 1949. Unlike most digitized newspaper databases, the OCR-generated text is visible and copyable. The collection spans the collapse of the Qing Dynasty, the Republican period, the Sino-Japanese War, and the civil war, offering comprehensive coverage of Chinese political and cultural life through the founding of the PRC.",9,5/13/2026 5:00pm
20,Bilingual Database and Annotated Bibliography of Cantonese Popular Periodicals of the Early Twentieth Century,二十世紀初省港澳通俗刊物雙語資料庫與解題書目,Subject Guides and Bibliographies,https://www.cantonpp.com/tc,Lord Wilson Heritage Trust,open access,ACLS Open Database Resource Guide,"Hong Kong,Macau,Gender,Literature,Popular media,Newspapers and periodicals,Republican era (1912–1949),Late Imperial (1368–1912)","The Bilingual Database and Annotated Bibliography of Cantonese Popular Periodicals of the Early Twentieth Century (Phase I) documents popular periodicals from the Cantonese cultural region—spanning Guangzhou, Hong Kong, and Macau—from approximately 1907 to the 1950s, with 80 annotated entries organized by category and location. Categories include children's publications, film, current events, literature and arts, women and family, martial arts, dance halls, hometown magazines, and comics. The project draws on periodicals from international databases and libraries in Hong Kong, Macau, and the United Kingdom, as well as private collections, and reflects the shared cultural networks connecting cities of the historic Cantonese cultural region.",7,5/16/2026 1:14pm
21,Old Hong Kong Newspapers,,Newspapers,https://sls.hkpl.gov.hk/digital-collection/en/collection_old-hk-newspapers.html,Hong Kong Public Libraries,open access,ACLS Open Database Resource Guide,"Hong Kong,Newspapers and periodicals,Full-text,Historical archive,Late Imperial (1368–1912),Republican era (1912–1949),Contemporary (post-1978)","The Old Hong Kong Newspapers collection, maintained by Hong Kong Public Libraries and accessible through their Digital Collection platform, provides digitized images of 14 major historical Hong Kong newspapers spanning from 1853 to 1991. Chinese-language titles include 香港工商日報 (1926–1984), 華僑日報 (1947–1991), 香港華字日報 (1895–1940), 大公報 (1938–1991), 遐邇貫珍 (1853–1856), and 循環日報 (1874–1886); English-language titles include the China Mail (1866–1961), Hong Kong Daily Press (1864–1941), and Hong Kong Telegraph (1881–1951), among others. The collection supports research into Hong Kong's historical development, society, and culture from the colonial era through the late twentieth century.",8,5/16/2026 7:44pm
22,East Asian Newspapers and Periodicals 1850-1950,,Newspapers,https://archive.org/details/eastasia-periodicals,Internet Archive,open access,ACLS Open Database Resource Guide,"Manchuria,Singapore,Colonialism,Historical archive,Newspapers and periodicals,Full-text,Late Imperial (1368–1912),Republican era (1912–1949)","The East Asian Newspapers and Periodicals 1850–1950 collection on the Internet Archive provides free access to 266 East Asian newspapers, journals, and magazines published in Chinese, Korean, and Japanese from 1850 to 1950. Major titles include the Shenbao (申報, founded 1872, Shanghai), the North-China Herald (1850–1941, Shanghai), the Chosun-ilbo (朝鮮日報, founded 1920, Korea), and the Manzhoubao (満洲報, 1922–1937, Dalian). The collection documents critical periods of East Asian history including colonial periods, wars, and social transformations across China, Japan, Korea, and Singapore.",8,5/13/2026 9:04pm
23,"Archives of the Institute of Modern History, Academia Sinica",,Archival Material,https://archivesonline.mh.sinica.edu.tw/,Academia Sinica,open access,ACLS Open Database Resource Guide,"Republican era (1912–1949),Economy,International relations,Late Imperial (1368–1912),Historical archive,Contemporary (post-1978),Early PRC (1949–1966)","The online archive system of the Institute of Modern History (AIMH) at Academia Sinica provides catalog search and digital image viewing for over 682,000 archival records in five major categories: Foreign Ministry Collection (1861–2009), Economic Ministry Collection (1903–1980), Personal Papers, Institutional Materials, and Historical Maps. The Foreign Ministry Collection documents China's foreign relations from the Zongli Yamen (1861–1900) through the ROC Ministry of Foreign Affairs (1928–2009); the Economic Ministry Collection, the largest single set, spans commerce and economic agencies from 1903 to 1980. Approximately half of the total holdings have been digitized; 60 percent of digitized items are viewable online, while the remainder require on-site reading room access.",9,5/16/2026 7:44pm
24,Digital Library of Qing Archives,清代檔案檢索系統,Archival Material,https://qingarchives.npm.edu.tw/index.php,"National Palace Museum, Taipei",open access,ACLS Open Database Resource Guide,"Late Imperial (1368–1912),Historical archive,Biography,Full-text","The Digital Library of Qing Archives (清代檔案檢索系統) at the National Palace Museum in Taipei integrates the Grand Council Archives Database (清代宮中檔奏折及軍機處檔折件), the Qing Historical Figures Database (大清國史人物列傳及史館檔傳包傳稿資料庫), the Index to Qing Archival Volumes (清代文獻檔冊目錄資料庫), and additional NPM Qing holdings into a single searchable system. Free account registration is required to view full-text images online. The database is an essential resource for research on Qing dynasty government, biography, and bureaucracy.",9,5/13/2026 9:04pm
