objectid,title,alternatetitle,category,externalurl,institution,access,sourcelist,tags,description,sau,lastmodified
1053,Jinshi Examination Database,历代进士登科数据库,Biographical Data,http://www.jinshiku.com/,"Zhonghua Shuju, Zhejiang University",subscription,Princeton China Studies Research Guide,"Late Imperial (1368–1912),Middle Period (220–1368),Biography,Law and Government","Compiled by Professor Gong Yanming from Zhejiang University and constructed by Zhonghua Shuju, this is the first section of the larger Biographical Examination Database (历代科举人物数据库). It records information on all Jinshi degree holders throughout Chinese history, including their regional and ancestral origins. The database currently includes information on over 102,000 Jinshi degree holders with search options by regional origin, dynasty, year of degree, and surname, and both accurate and fuzzy searches are available. Each entry cites its historical sources, and statistical analysis functions are also provided. To access, click on 登录 and choose IP登录. Copying is limited to 200 characters at a time using the built-in pop-up copy function; downloading is not possible. Users may also register a personal account for features such as saving searches and submitting corrections.",9,5/19/2026 12:14pm
1054,Zhongguo dabaike quanshu,中国大百科全书,Encyclopedias,https://www.zgbk.com/,Encyclopedia of China Publishing House,subscription,Princeton China Studies Research Guide,Full-text,"China's first modern large-entry encyclopedia in the Chinese language, published by the Encyclopedia of China Publishing House. The third edition was launched online in 2014 as the Digital Zhongguo Dabaike Quanshu, incorporating multimedia and structured into professional, thematic, and popular sections. As of 2023 the platform hosts over 210,000 entries covering all major fields of knowledge with full-text search across articles, images, and multimedia.",7,5/19/2026 12:14pm
1055,Academia Sinica Hanji wenxian ziliaoku,漢籍電子文獻資料庫,Classical Texts,https://hanchi.ihp.sinica.edu.tw/,Institute of History and Philology (Academia Sinica),open access,Princeton China Studies Research Guide,"Early China (before 220 CE),Middle Period (220–1368),Late Imperial (1368–1912),Full-text","Full-text database of classical Chinese texts digitized by the Institute of History and Philology of the Academia Sinica, Taipei. The database is UTF-8 encoded with no additional font download required. Click on 「shouquan shiyong」 (authorized access) to enter. For a listing of titles included, click on 書目瀏覽 and then search by title with nothing in the search box.",9,5/19/2026 12:14pm
1056,CHANT (Chinese Ancient Texts),漢達文庫,Classical Texts,http://www.chant.org/,Institute of Chinese Studies (Chinese University of Hong Kong),subscription,Princeton China Studies Research Guide,"Early China (before 220 CE),Middle Period (220–1368),Archaeology,Full-text","The CHANT (CHinese ANcient Texts) databases, compiled under the Institute of Chinese Studies of the Chinese University of Hong Kong since 1988, give full-text access (single words, phrases and sentence patterns) to all traditional texts from the Pre-Han period through the Six Dynasties (581 AD), covering over 30 million characters. Texts are divided into two databases: Pre-Han & Han (Xian Qin Liang Han), and Six Dynasties (Wei Jin Nanbeichao). During compilation, different versions of the same texts were carefully compared and modern punctuation was added. CHANT also includes databases of excavated wood/bamboo and silk scripts (the Zhu-jian-bo shu database), oracular inscriptions (the Jiaguwen database), and bronze inscriptions (Jinwen), as well as a database of extant Chinese encyclopedias (Leishu). To enter, click first on 'dengru wenku', and then on 'jigou yonghu dengru' (IP user only; no password is necessary for institutional IP access). Navigation until entering each database is slow; searching is faster. To use the databases fully, download and install the specialized fonts from the download page after logging in.",9,5/14/2026 11:11pm
1057,Diaolong database collection,雕龙中日古籍全文检索数据库,Classical Texts,http://www.diaolong.cn/,Diaolong,subscription,Princeton China Studies Research Guide,"Middle Period (220–1368),Late Imperial (1368–1912),Dunhuang,Full-text,Historical archive","Database of classical Chinese and Japanese texts providing full-text access to a wide range of major collections, including: the Zhengtong daozang (Daoist scriptures) and Daozang jiyao; manuscript collections from Dunhuang; the Imperial Encyclopedia (Yongle dadian); the Imperial Library (Gujin tushu jicheng); collected historical material on the Qing dynasty (including the five-dynasty huitian, Qing shilu, and Jinshen quanshu series); a collection of old Japanese books; the two collectanea Sibu congkan and Sibu beiyao; and the Siku quanshu, Xuxiu siku quanshu, Siku catalog, banned books from the Siku, and supplemental texts to the Siku. An alternative access portal (Fanyun wenxian 繃雲文獻) is available; select 古籍文獻 to access the same content.",9,5/14/2026 11:11pm
1058,Digital Library of Chinese Rare Books,古漢籍善本數位化資料庫,Classical Texts,https://rbook.ncl.edu.tw/,National Central Library (Taiwan),open access,Princeton China Studies Research Guide,"Early China (before 220 CE),Middle Period (220–1368),Late Imperial (1368–1912),Full-text,Historical archive","A collaborative digitization project, sponsored by Chiang Ching-kuo Foundation for International Scholarly Exchange Program, which includes Chinese rare books digitized from the collections of four participating libraries: the Asian Division of the Library of Congress, the East Asian Library and the Gest Collection of Princeton University, the Harvard-Yenching Library of Harvard University, and the Fu Ssu-Nien Library of the Institute of History and Philology of the Academia Sinica in Taiwan. Each library provided some 100,000 images, covering between 171 and 295 titles each.  They have now been made available free of charge to the world. A description of the project is available.",9,5/14/2026 11:11pm
1059,Dunhuang wenxian ku,敦煌文獻庫,Classical Texts,https://www.wenzibase.com/,Erudition (Airusheng),subscription,Princeton China Studies Research Guide,"Dunhuang,Middle Period (220–1368),Full-text,Buddhism","Full-text and image database of texts discovered at Dunhuang. When complete, the database will provide access to 30,000 titles and documents; currently some 3,000 texts are available in both full-text searchable and original image format. The database is unique in providing interlinear notes, corrections, overlapping and upside-down characters, and images alongside the searchable text. To access, select 'Ancient Classics' on the platform landing page, then choose login and click 'jinru' (enter) on the database home page.",8,5/19/2026 12:14pm
1060,Fojiao Jingdian ku,佛教經典庫,Classical Texts,https://www.wenzibase.com/,Erudition (Airusheng),subscription,Princeton China Studies Research Guide,"Buddhism,Middle Period (220–1368),Late Imperial (1368–1912),Full-text","The Buddhist Classics Database provides full-text access to collections of Buddhist scriptures, with scans of original scriptures viewable side-by-side with the machine-readable text. The first installment includes the Qisha Song Tripitaka (宋碧砂藏) and the Zhaocheng Jin Tripitaka (金赵城藏). To access, select 'Ancient Classics' on the platform landing page, then choose login and click 'jinru' (enter) on the database home page.",8,5/14/2026 11:11pm
1061,Gujin tushu jicheng,古今圖書集成,Classical Texts,http://db1.udpweb.com.tw/udp2018/,United Digital Publications,subscription,Princeton China Studies Research Guide,"Middle Period (220–1368),Late Imperial (1368–1912),Full-text,Historical archive","The Gujin tushu jicheng , compiled by Chen Menglei et al. and published with movable copper type in 1726-28, is by far the largest leishu to have been printed (6,109 subsections, 852,408 pages.) Under each subsection excerpts from sources are gathered from the beginnings of writing to the 17th century, from a 18th-century standpoint. The full text is included in the Taiwan Academic Classics Database. You can search the full text, but resulting pages are also viewable as PDFs. To browse individual parts of Gujin tushu jicheng , you can open the menu on the left by clicking on 標點古今圖書集成. You will then be able to browse by different categories. Please also note the possibility to switch the language of the interface to English on the top of the page. Alternatively the Diaolong database collection also provides access to the Gujin tushu jicheng .",8,5/19/2026 3:34pm
1062,Lidai shiwenji zongku,歷代詩文集總庫,Classical Texts,https://www.wenzibase.com/,Erudition (Airusheng),subscription,Princeton China Studies Research Guide,"Middle Period (220–1368),Late Imperial (1368–1912),Literature,Full-text","The Lidai shiwenji zongku 歷代詩文集總庫 (formerly Lidai bieji ku 歷代別集庫) is an Erudition (Airusheng) classical text database consisting of the collected poetry and prose writings of individual authors, covering the full range of pre-Ming, Ming, and Qing authors as well as multi-author anthologies—over 9,000 titles in total, carefully digitized and checked for optimal full-text searching. To access, select 'Ancient Classics' from the platform landing page, then choose 歷代詩文集總庫; sub-databases for 'Ming qian', 'Ming 1', 'Qing 1', 'Qing 2', and 'zongji bian' will be highlighted.",8,5/14/2026 11:24pm
1063,Lidai jiao wai she fo wenxian shujuku,歷代教外涉佛文獻數據庫,Classical Texts,https://guji.zhbc.com.cn/,Zhonghua Shuju,subscription,Princeton China Studies Research Guide,"Early China (before 220 CE),Middle Period (220–1368),Late Imperial (1368–1912),Buddhism,Local history,Philosophy,Full-text","A database of Buddhist-related documents from non-Buddhist sources published by Zhonghua Shuju, assembled and punctuated by Prof. Li Shen 李申 of Shanghai Normal University. Collects a wide variety of documents including edicts, monastery records, stele inscriptions, rock carvings from Buddhist sites, philosophical texts, and poems, drawn from sources including the Siku quanshu, Xuxiu siku quanshu, various inscription collections, Quan Song wen, Quan Liao wen, Ming-Qing shilu, local gazetteers, and many other sources. The collection is divided into four sections: Jin shi fo zong 金石佛蹤, Shi bu fo ji 史部佛跡, Zi bu fo ying 子部佛影, and Ji bu fo lun 集部佛論; each section can be browsed individually or searched simultaneously. To access, click on 登录 and choose IP登录. Users may register a personal account for features such as copying text and saving searches.",8,5/14/2026 11:24pm
1064,National Library of China e-resources - 中国国家图书馆数字资源,中国国家图书馆数字资源,Classical Texts,http://read.nlc.cn/,National Library of China,open access,Princeton China Studies Research Guide,"Tibet,Dunhuang,Republican era (1912–1949),Buddhism,Military,Law,Biography,Medicine,Full-text,Genealogy,Early China (before 220 CE),Local history","The National Library of China (NLC) has opened 31 databases on its 中国古籍保护网 to the public, with additional databases on Republican materials and national minorities added recently. All databases are freely accessible. Sub-collections include: 数字古籍 Digital Rare Books; 数字方志 Digital Gazetteers (side-by-side transcribed text and image; not full-text searchable); 中华寻根网 China genealogical database (bibliographic information on 30,000 jiapu, reading access to over 2,000 titles, biographical entries for 14,000 individuals); 赵城金藏 Zhaocheng Jin Tripitaka (scan access only); 年画撷英 New Year prints; 碞帖精华 Rubbings database (full-text searchable transcriptions); 宋人文集 Collected works of the Song; 甲骨世界 Oracle Bones; 西夏文献 Tangut texts; 名家手稿 Famous author manuscripts; 徽州善本家谱 Huizhou Jiapu; 中华医药典籍资源库 Classical works of Chinese medicine; 法藏敦煌遗书 Dunhuang collections of the Bibliothèque Nationale de France; rare book collections from Yunnan, Tianjin, Yangzhou, Shanghai Library, Toyo Bunko, Harvard Yenching, and Shandong University; 民国时期文献 (approx. 100,000 titles of Republican e-books); 民国法律 Republican laws; 民国期刊 (approx. 8,000 Republican journal titles); 民国报纸 selected Republican newspapers; 电子图书 modern e-books; 博士论文 doctoral thesis index; 民族文字古籍特藏库 national minorities rare books; 日本细菌战资源库 Japanese Bacteriological Warfare database; 东京审判资源库 Tokyo Trials database (note: different from the Tokyo Trials Literature Database developed by Shanghai Jiaotong University); and 中华古籍善本联合书目 Chinese Shanben Catalog. NLC does not currently provide a central search index across all databases; most collections are listed in the Zhongguo Yanjiu Faxian discovery system.",9,5/19/2026 3:34pm
1065,Zhongguo yanjiu faxian,中国研究发现,Subject Guides and Bibliographies,http://guji.dahailaozhen.cn/,Zhenben Technology (珍本科技),subscription,Princeton China Studies Research Guide,Historical archive,"Previously known as Guji faxian 古籍发现 and Quanwen faxian 全文发现, this database started as a discovery service for digitized Chinese rare books, collecting information about editions from libraries in China, the United States, and Europe. Individual entries link back to the original scans hosted by the respective institutions. Clicking on 检索 without a search term allows browsing the entire database via a simplified Sibu 四库 classification with maps, gazetteers, and congshu as additional browsing categories. Currently the portal lists about 100,000 editions. More recently the database integrated material from the previous Zhongguo yanjiu wangluo ziyuan daohang 中国研究网络资源导航 and provides an easy-to-navigate overview of many free and freely registerable databases in Chinese Studies available on the Internet.",7,5/19/2026 3:34pm
1066,Sibu congkan,四部叢刊,Classical Texts,https://www.oriprobe.com/sibucongkan.shtml,Oriprobe Information Services,subscription,Princeton China Studies Research Guide,"Early China (before 220 CE),Middle Period (220–1368),Late Imperial (1368–1912),Full-text","Fully searchable collection of 504 original and historical works (3,134 volumes) published by the Commercial Press in 1919–1936. The original collection used photolithography, which resulted in higher-quality editions than the then-available typeset editions. Both full-text search and page images of the authoritative editions are available. The Sibu congkan is also accessible via the Diaolong database collection.",7,5/19/2026 3:34pm
1067,Siku quanshu,四庫全書,Classical Texts,http://www.sikuquanshu.com/,Digital Heritage Publishing Ltd.,subscription,Princeton China Studies Research Guide,"Early China (before 220 CE),Middle Period (220–1368),Late Imperial (1368–1912),Full-text","Electronic database published by Digital Heritage Publishing Ltd. (Hong Kong) in association with the Chinese University of Hong Kong. Contains the complete contents in full text and image of the 3,460+ titles of the Wenyuange edition of the Siku quanshu (1782), totaling over 800 million characters arranged under almost 2 million piece titles. Titles include large compilations such as the Quan Tang shi, Zi zhi tong jian, Wen xuan, Pei wen yun fu, Tai ping yu lan, and the 25 Histories. Note that the Siku quanshu editions are not always the best available or complete, as the compilation involved censorship. Features include linked dictionaries and the ability to save notebooks. The Siku quanshu is also available via the Diaolong database collection.",9,5/14/2026 11:24pm
1068,Taiwan Academic Classics,,Classical Texts,http://db1.udpweb.com.tw/tac/,United Digital Publications,subscription,Princeton China Studies Research Guide,"Taiwan,Middle Period (220–1368),Late Imperial (1368–1912),Full-text,Early China (before 220 CE)","Taiwan Academic Classics (TAC) is an interdisciplinary digital research platform from United Digital Publications that brings together over 6,600 classical texts spanning China's earliest dynasties, approximately 300 academic journals in the humanities and social sciences, and more than 100,000 dissertations in Chinese studies. The platform integrates content from leading Taiwanese academic institutions, including journals and rare materials from Academia Sinica and the National Palace Museum, searchable across two billion characters. TAC also includes the punctuated full-text edition of the Gujin tushu jicheng and the Scripta Sinica journal database.",7,5/19/2026 3:34pm
1069,Xuxiu siku quanshu,續修四庫全書,Classical Texts,http://www.diaolong.cn/,China Educational Publications Import and Export Corporation (CEPIEC),subscription,Princeton China Studies Research Guide,"Middle Period (220–1368),Late Imperial (1368–1912),Full-text","Set of 5,328 full-text searchable classical Chinese titles forming an important addition to the Siku quanshu. Based on an assessment of important works post-dating the 18th-century Siku compilation, it is arranged in the same classification scheme and is strongest in Qing material, but also includes better versions of some earlier texts. Originally published in 1,800 volumes drawn from over 80 Chinese libraries. The database allows comparison of OCR text with original page images. Available as part of the Diaolong database collection; note that the Xuxiu Siku quanshu content appears as 'Siku fenlei shu 四庫分類書' in the Fanyun wenxian 繃雲文獻 alternative portal.",8,5/19/2026 3:34pm
1070,Zhongguo jiben guji ku,中國基本古籍庫,Classical Texts,https://www.wenzibase.com/,Erudition (Airusheng),subscription,Princeton China Studies Research Guide,"Early China (before 220 CE),Middle Period (220–1368),Late Imperial (1368–1912),Full-text","One of the Erudition (Airusheng) classical text databases, containing approximately 10,000 traditional titles (plus 4,500 additional editions of the same titles) covering a wide variety of subjects from many historical periods—from the pre-Qin era through the Republican period. Full-text searchable with page images available for comparison. It has become the most widely used classical Chinese text database in the PRC. Note that OCR character conversion errors can occur; consulting image-based texts may be necessary. To access, select 'Ancient Classics' from the platform landing page, then choose the database and click 'jinru' (enter).",9,5/14/2026 11:24pm
1071,Zhongguo suwen ku,中國俗文庫,Classical Texts,https://www.wenzibase.com,Erudition (Airusheng),subscription,Princeton China Studies Research Guide,"Dunhuang,Literature,Full-text,Middle Period (220–1368),Late Imperial (1368–1912),Popular media","When complete, this database will contain more than 10,000 pieces of Chinese popular literature across various genres—including bianwen, baojuan, shanshu, huaben, zhanghui xiaoshuo, zaju, chuanqi, zhugongdiao, and guci—all in full-text format alongside images of the original source pages (including manuscript fragments from Dunhuang). Each genre can be searched independently. Published by Erudition (Airusheng).",8,5/19/2026 8:35pm
1072,Zhonghua jingdian guji ku,中華經典古籍庫,Classical Texts,https://guji.zhbc.com.cn,Zhonghua Shuju,subscription,Princeton China Studies Research Guide,"Early China (before 220 CE),Middle Period (220–1368),Late Imperial (1368–1912),Literature,Biography,Philosophy,Full-text","The Zhonghua Classics Database contains the standard punctuated versions of many important Chinese classical texts in philosophy, history, and literature (including biji), as published by Zhonghua Shuju and other major punctuated-edition publishers. The database also includes the 360-volume Quan Song Wen 《全宋文》 as e-books. In addition to browsing titles in full, the database has been optimized for simultaneous searching of character variants (defaults adjustable in advanced search), with especially useful tools for searching variants of biographical data and place names. Dictionary and chronology-converter functions are embedded and activate automatically when a character is selected in the main text. Access is via IP authentication; no individual registration is needed for basic reading and searching. For additional features—copying text (maximum 200 characters at a time via the pop-up copy function), making notes, submitting corrections, and saving searches—individual account registration using an email address is required. The original printed text is available for comparison by clicking the orange page numbers in the running text. Downloading is not possible. Works well with Chrome; some page-image display issues have been noted with Firefox.",9,5/14/2026 11:35pm
1073,Grand Ricci Online,Le Grand Ricci,Dictionaries,https://chinesereferenceshelf.brillonline.com/grand-ricci,Institut Ricci,subscription,Princeton China Studies Research Guide,"Medicine,Religion,Full-text,Early China (before 220 CE),Middle Period (220–1368),Late Imperial (1368–1912)","Le Grand Ricci is to all purposes the most comprehensive bilingual dictionary of Chinese (into French) in the Western world. It covers three millennia of the Chinese language, from the Classics to the modern age, and is encyclopedic in its scope. The compilers were able to draw on the full range of French sinological expertise in completing the project, and has paid especially attention to specialized terms in a wide variety of fields (religion, medicine etc.) It contains 13,392 main entries (single characters) and 280,000 expressions (or Chinese words composed of a set of characters). Entries can be looked up by Chinese character, by romanization (pinyin), by radical and strokes, and by the total number of strokes.",9,5/19/2026 4:21pm
1074,Ricci Dictionary of Chinese Law,,Dictionaries,https://chinesereferenceshelf.brillonline.com/chinese-law,Brill,subscription,Princeton China Studies Research Guide,"Law,Full-text,Early China (before 220 CE),Middle Period (220–1368),Late Imperial (1368–1912)","Trilingual (Chinese, English, French) dictionary on Chinese law with approximately 24,000 legal terms. Includes ancient law. Part of BrillOnline Chinese reference library. Has separate versions in Traditional and Simplified Chinese characters.",8,5/19/2026 4:21pm
1075,Thesaurus Linguae Sericae (TLS),漢學文典,Dictionaries,http://tls.uni-hd.de/,Heidelberg University,open access,Princeton China Studies Research Guide,"Full-text,Digital humanities,Early China (before 220 CE)","The Thesaurus Linguae Sericae (TLS) is an historical and comparative encyclopaedia of Chinese conceptual schemes, designed as a collaborative forum for the close reading of Chinese texts in cross-cultural conceptual history. It provides a corpus of classical Chinese texts—wherever possible with interlinear translations—linked to an analytic dictionary of the Chinese language. The Thesaurus was founded by Christoph Harbsmeier (University of Oslo) and is developed in cooperation with the Center for Informatics in East-Asian Studies (Kyoto University). It is hosted by the Heidelberg Centre for Transcultural Studies (HCTS) at Heidelberg University.",8,5/19/2026 4:21pm
1076,Chinese Doctor and Master Dissertations / CNKI,博硕士学位论文 / 中国知网,Dissertations and Theses,https://oversea.cnki.net/,CNKI (China National Knowledge Infrastructure),subscription,Princeton China Studies Research Guide,"Full-text,Secondary sources,Contemporary (post-1978)",Selected dissertations and theses from the PRC in all subject areas. Due to Chinese government intervention access is currently limited to Humanities subjects only.,7,5/19/2026 4:21pm
1077,Chinese Electronic Theses and Dissertations (airiti library),,Dissertations and Theses,https://www.airitilibrary.com/,Airiti Inc.,subscription,Princeton China Studies Research Guide,"Taiwan,Hong Kong,Full-text,Secondary sources","Selected dissertations and theses from various universities in Taiwan, as well as Hong Kong University, are available in this database. Starting dates vary; HKU starts in 1990, other institutions in the 2000s. The database has moved into the general AiritiLibrary platform, which also includes Taiwanese periodical literature. To retrieve theses specifically, searches should be limited to 'CETD'. Includes more dissertations than the free National Digital Library of Theses and Dissertations in Taiwan (NCL).",7,5/19/2026 4:21pm
1078,Dissertation Abstracts (ProQuest Dissertations & Theses: Full Text),,Dissertations and Theses,https://www.proquest.com/,ProQuest,subscription,Princeton China Studies Research Guide,"Full-text,Secondary sources","Access to citations and abstracts for every title in the Dissertation Abstracts database, including those on East Asia. Dissertations written from 1997 forward are available full text; many earlier ones as well. The database includes citations to dissertations from 1861 to those accepted last semester. Citations for dissertations and master’s theses published from 1980 forward have abstracts.",7,5/19/2026 4:21pm
